{
  "categories": [
    {
      "category": "UNIT",
      "module_count": 120,
      "modules": [
        "tests.unit.api.test_wp16_documentation",
        "tests.unit.application.test_assessment_cli",
        "tests.unit.application.test_assessment_input",
        "tests.unit.application.test_assessment_preflight",
        "tests.unit.application.test_coverage_cli",
        "tests.unit.application.test_release_boundaries",
        "tests.unit.application.test_release_cli",
        "tests.unit.application.test_release_manifest",
        "tests.unit.application.test_release_pinning",
        "tests.unit.application.test_release_service",
        "tests.unit.application.test_release_source_gate",
        "tests.unit.application.test_report_cli",
        "tests.unit.application.test_rollback",
        "tests.unit.benchmark.test_cli",
        "tests.unit.closure.test_h01_decision",
        "tests.unit.closure.test_wave03_authority",
        "tests.unit.closure.test_wave03_release",
        "tests.unit.closure.test_wave03_science",
        "tests.unit.closure.test_wave03b_assessment",
        "tests.unit.closure.test_wave03b_capture",
        "tests.unit.closure.test_wave05_expert_package",
        "tests.unit.closure.test_wp_c00_dispositions",
        "tests.unit.closure.test_wp_c03_checkpoints",
        "tests.unit.closure.test_wp_c14b",
        "tests.unit.closure.test_wp_c15_pre_final",
        "tests.unit.curation.test_conflict_and_insufficiency",
        "tests.unit.curation.test_curation_boundaries",
        "tests.unit.curation.test_curation_protocol_cli",
        "tests.unit.curation.test_curation_records",
        "tests.unit.curation.test_exercise",
        "tests.unit.curation.test_protocol_structure",
        "tests.unit.curation.test_roles_and_cases",
        "tests.unit.curation.test_wp09_documentation",
        "tests.unit.curation.workflow.test_audit_and_immutability",
        "tests.unit.curation.workflow.test_forms_and_cli",
        "tests.unit.curation.workflow.test_persistence_adapters",
        "tests.unit.curation.workflow.test_roles_and_gates",
        "tests.unit.curation.workflow.test_rule_approval_envelope",
        "tests.unit.curation.workflow.test_state_machine",
        "tests.unit.curation.workflow.test_wp10_boundaries",
        "tests.unit.curation.workflow.test_wp10_documentation",
        "tests.unit.engine.test_coverage_aggregation",
        "tests.unit.engine.test_coverage_axis",
        "tests.unit.engine.test_coverage_manifest",
        "tests.unit.engine.test_normalization",
        "tests.unit.engine.test_phenotype_cli",
        "tests.unit.engine.test_profile",
        "tests.unit.engine.test_risk_execution",
        "tests.unit.engine.test_wp12_boundaries",
        "tests.unit.engine.test_wp12_documentation",
        "tests.unit.engine.test_wp13_boundaries",
        "tests.unit.engine.test_wp13_documentation",
        "tests.unit.engine.test_wp14_boundaries",
        "tests.unit.engine.test_wp14_documentation",
        "tests.unit.evidence.test_draft_curation",
        "tests.unit.evidence.test_evidence_boundaries",
        "tests.unit.evidence.test_evidence_build",
        "tests.unit.evidence.test_evidence_cli",
        "tests.unit.evidence.test_extraction",
        "tests.unit.evidence.test_identity_and_version",
        "tests.unit.evidence.test_record_types_and_publications",
        "tests.unit.evidence.test_source_separation",
        "tests.unit.evidence.test_traceability",
        "tests.unit.evidence.test_wp08_documentation",
        "tests.unit.infrastructure.test_assessment_persistence",
        "tests.unit.infrastructure.test_packaging_and_environment",
        "tests.unit.ingestion.test_acquisition",
        "tests.unit.ingestion.test_clinpgx_catalog",
        "tests.unit.ingestion.test_ingestion_cli",
        "tests.unit.ingestion.test_request_key_and_cache",
        "tests.unit.ingestion.test_transport_and_retry",
        "tests.unit.normalization.test_artifact_extraction",
        "tests.unit.normalization.test_canonical_build",
        "tests.unit.normalization.test_canonical_models",
        "tests.unit.normalization.test_data_quality",
        "tests.unit.normalization.test_deduplication",
        "tests.unit.normalization.test_identity_allocation",
        "tests.unit.normalization.test_normalization_boundaries",
        "tests.unit.normalization.test_normalize_cli",
        "tests.unit.normalization.test_normalize_rules",
        "tests.unit.normalization.test_quality_decision",
        "tests.unit.normalization.test_quality_transition",
        "tests.unit.normalization.test_strict_resolver",
        "tests.unit.normalization.test_wp07_documentation",
        "tests.unit.reporting.test_canonical_result",
        "tests.unit.reporting.test_fact_preservation",
        "tests.unit.reporting.test_structured_report",
        "tests.unit.reporting.test_wp15_boundaries",
        "tests.unit.reporting.test_wp15_documentation",
        "tests.unit.rules.test_condition_language",
        "tests.unit.rules.test_conflicts",
        "tests.unit.rules.test_engine_registry",
        "tests.unit.rules.test_exact_semantics",
        "tests.unit.rules.test_persistence_adapters",
        "tests.unit.rules.test_rule_document",
        "tests.unit.rules.test_rule_lifecycle",
        "tests.unit.rules.test_rules_cli",
        "tests.unit.rules.test_ruleset_lifecycle",
        "tests.unit.rules.test_validator",
        "tests.unit.rules.test_wp11_boundaries",
        "tests.unit.rules.test_wp11_documentation",
        "tests.unit.scientific.test_conflict_policy",
        "tests.unit.scientific.test_publication_gate",
        "tests.unit.scientific.test_registry_config",
        "tests.unit.scientific.test_scientific_boundaries",
        "tests.unit.scientific.test_source_policy_cli",
        "tests.unit.scientific.test_vocabularies",
        "tests.unit.verification.test_cli",
        "tests.unit.verification.test_coverage_and_database",
        "tests.unit.verification.test_discovery_and_inventory",
        "tests.unit.verification.test_gate_status",
        "tests.unit.verification.test_matrix",
        "tests.unit.verification.test_runner_and_results",
        "tests.unit.verification.test_wp19_boundaries",
        "tests.unit.web.test_accessibility",
        "tests.unit.web.test_client",
        "tests.unit.web.test_demo_migration",
        "tests.unit.web.test_pages",
        "tests.unit.web.test_view_models",
        "tests.unit.web.test_wp17_boundaries"
      ],
      "static_outcome": "BLOCKED",
      "test_count": 3514,
      "test_id_sha256": "62a3e926cb1b5a6c2a883baf2edbecd9f6c9664e54b99583d7ce815b7bafeaaa"
    },
    {
      "category": "DOMAIN_INVARIANT",
      "module_count": 44,
      "modules": [
        "tests.safety.test_assessment_safety",
        "tests.safety.test_coverage_safety",
        "tests.unit.api.test_safety",
        "tests.unit.audit.test_governed_audit",
        "tests.unit.benchmark.test_metric_computation",
        "tests.unit.benchmark.test_metric_definitions",
        "tests.unit.benchmark.test_metric_values",
        "tests.unit.deployment.test_audit_read_back",
        "tests.unit.deployment.test_composition",
        "tests.unit.deployment.test_request_scope_transaction",
        "tests.unit.domain.test_dependency_boundaries",
        "tests.unit.domain.test_hashing",
        "tests.unit.domain.test_identifiers",
        "tests.unit.domain.test_immutability",
        "tests.unit.domain.test_models",
        "tests.unit.domain.test_ports",
        "tests.unit.domain.test_typed_boundaries",
        "tests.unit.engine.test_truth_matrix",
        "tests.unit.expert_review.test_blinding",
        "tests.unit.expert_review.test_immutability_and_audit",
        "tests.unit.expert_review.test_state_machine",
        "tests.unit.reporting.test_safe_status_rendering",
        "tests.unit.rules.test_safety_invariants",
        "tests.unit.safety.test_gate",
        "tests.unit.safety.test_invariant_001",
        "tests.unit.safety.test_invariant_002",
        "tests.unit.safety.test_invariant_003",
        "tests.unit.safety.test_invariant_004",
        "tests.unit.safety.test_invariant_005",
        "tests.unit.safety.test_invariant_006",
        "tests.unit.safety.test_invariant_007",
        "tests.unit.safety.test_invariant_008",
        "tests.unit.safety.test_invariant_009",
        "tests.unit.safety.test_invariant_010",
        "tests.unit.safety.test_invariant_011",
        "tests.unit.safety.test_invariant_012",
        "tests.unit.safety.test_registry",
        "tests.unit.scientific.test_fail_closed",
        "tests.unit.security.test_authentication_service",
        "tests.unit.security.test_passwords",
        "tests.unit.security.test_users_and_sessions",
        "tests.unit.test_claims",
        "tests.unit.ths6.test_vocabulary_and_models",
        "tests.unit.web.test_safety"
      ],
      "static_outcome": "BLOCKED",
      "test_count": 1047,
      "test_id_sha256": "946688bd7cfa582b9a3c396ef0067ffc582e978fd12e2dfec6d2fe77b0896017"
    },
    {
      "category": "FAILURE_NEGATIVE",
      "module_count": 5,
      "modules": [
        "tests.adversarial.test_report_claims",
        "tests.failure.test_domain_layer_violations",
        "tests.failure.test_wp18_partition_violations",
        "tests.unit.benchmark.test_benchmark_contract",
        "tests.unit.engine.test_failure_modes"
      ],
      "static_outcome": "BLOCKED",
      "test_count": 97,
      "test_id_sha256": "1581d747bedaef65f4d70b2da055e71ff1cd89a41f38279532d6fa07ed3d5401"
    },
    {
      "category": "INTEGRATION",
      "module_count": 7,
      "modules": [
        "tests.integration.api.test_candidate_runtime_composition",
        "tests.integration.engine.test_assessment_end_to_end",
        "tests.integration.engine.test_coverage_end_to_end",
        "tests.integration.engine.test_wp11_integration",